### ISSUE TITLE
quantum returns exception on every command

### ISSUE THREAD

**Issue by AbelNavarro** [midokura/midonet-openstack#24]
I found a problem I think it's related to yesterday changes: I cannot any longer use quantum from the command line. Horizon seems to have no problem with it, but every time I want to issue a quantum command I got an exception. These are the last lines from that exception in debug mode:

File "/usr/lib/python2.7/dist-packages/quantumclient/client.py", line 207, in authenticate
    self._extract_service_catalog(body)
  File "/usr/lib/python2.7/dist-packages/quantumclient/client.py", line 176, in _extract_service_catalog
    endpoint_type='adminURL')
  File "/usr/lib/python2.7/dist-packages/quantumclient/client.py", line 80, in url_for
    raise exceptions.EndpointNotFound()
EndpointNotFound: An unknown exception occurred.

I checked keystone DB and everything seems right, although "adminurl" is written "adminURL". Have you found this problems before?

Yesterday changes were (quoting Taku):

> The template file and config file of gui.midokura.com are following. And I think you should set the appropriate global IP or domain name which is reachable from the external network if you're running the CP on the local because the CP on the local would access to the API server with those URIs.
> 
> I'm also attaching the original files to make sure you'll get the correct configs.
> 
> $ sudo cat /etc/keystone/default_catalog.templates
> ...
> # MidoNet
> 
> catalog.RegionOne.midonet.publicURL = http://ec2-50-18-30-131.us-west- 1.compute.amazonaws.com:8080/midolmanj-mgmt/
> catalog.RegionOne.midonet.adminURL = http://ec2-50-18-30-131.us-west-1.compute.amazonaws.com:8080/midolmanj-mgmt/hosts
> catalog.RegionOne.midonet.internalURL = http://ec2-50-18-30-131.us-west-1.compute.amazonaws.com:8080/midolmanj-mgmt/
> catalog.RegionOne.midonet.name = MidoNet API Service
> 
> $ sudo cat /etc/keystone/keystone.conf
> ...
> [catalog]
> # driver = keystone.catalog.backends.sql.Catalog
> 
> driver = keystone.catalog.backends.templated.TemplatedCatalog
> template_file = /etc/keystone/default_catalog.templates

**Comment by tomoe** [comment]
What is the body you get from the keystone API in authenticate() method in the stacktrace?

**Comment by AbelNavarro** [comment]
How can I get that information? the most I can see in the log, using debug, is this:

```
(eventlet.wsgi.server): 2013-02-28 12:33:53,824 DEBUG 10.0.1.2 - - [28/Feb/2013 12:33:53] "POST /v2.0/tokens HTTP/1.1" 200 2442 0.119399
```

**Comment by tomoe** [comment]
Here's what I can think of. You can either 
- add debug print, 
- add python debugger; import pdb; pdb.set_trace(), or
- tcpdump

**Comment by AbelNavarro** [comment]
oops, erased last comment:

This is the output of "quantum router-list" as seen by wireshark. All the
commands have similar results.

POST /v2.0/tokens HTTP/1.1
Host: 10.0.1.2:5000
Content-Length: 105
content-type: application/json
accept-encoding: gzip, deflate
accept: application/json
user-agent: python-quantumclient

{"auth": {"tenantName": "admin", "passwordCredentials": {"username":
"admin", "password": "admin_pass"}}}

HTTP/1.1 200 OK
Vary: X-Auth-Token
Content-Type: application/json
Date: Thu, 28 Feb 2013 16:06:21 GMT
Transfer-Encoding: chunked

8f6
{"access": {"token": {"expires": "2013-03-01T16:06:21Z", "id":
"3630db5c8c8046c589550ffb6fa7899a", "tenant": {"enabled": true,
"description": null, "name": "admin", "id":
"12664fe39afa4cd1a6ea3bf77f2b5e70"}}, "serviceCatalog": [{"endpoints":
[{"adminurl": "http://bcn2.midokura.com:8080/midolmanj-mgmt/hosts",
"region": "RegionOne", "publicURL": "
http://bcn2.midokura.com:8080/midolmanj-mgmt/", "internalURL": "
http://bcn2.midokura.com:8080/midolmanj-mgmt/"}], "endpoints_links": [],
"type": "midonet", "name": "MidoNet API Service"}, {"endpoints":
[{"adminurl": "http://localhost:8774/v1.1/12664fe39afa4cd1a6ea3bf77f2b5e70",
"region": "RegionOne", "publicURL": "
http://localhost:8774/v1.1/12664fe39afa4cd1a6ea3bf77f2b5e70",
"internalURL": "http://localhost:8774/v1.1/12664fe39afa4cd1a6ea3bf77f2b5e70"}],
"endpoints_links": [], "type": "compute", "name": "Compute Service"},
{"endpoints": [{"adminurl": "http://localhost:9292/v1", "region":
"RegionOne", "publicURL": "http://localhost:9292/v1", "internalURL": "
http://localhost:9292/v1"}], "endpoints_links": [], "type": "image",
"name": "Image Service"}, {"endpoints": [{"adminurl": "
http://localhost:8776/v1/12664fe39afa4cd1a6ea3bf77f2b5e70", "region":
"RegionOne", "publicURL": "
http://localhost:8776/v1/12664fe39afa4cd1a6ea3bf77f2b5e70", "internalURL": "
http://localhost:8776/v1/12664fe39afa4cd1a6ea3bf77f2b5e70"}],
"endpoints_links": [], "type": "volume", "name": "Volume Service"},
{"endpoints": [{"adminurl": "http://localhost:8773/services/Admin",
"region": "RegionOne", "publicURL": "http://localhost:8773/services/Cloud",
"internalURL": "http://localhost:8773/services/Cloud"}], "endpoints_links":
[], "type": "ec2", "name": "EC2 Service"}, {"endpoints": [{"adminurl": "
http://localhost:35357/v2.0", "region": "RegionOne", "publicURL": "
http://localhost:5000/v2.0", "internalURL": "http://localhost:5000/v2.0"}],
"endpoints_links": [], "type": "identity", "name": "Identity Service"}],
"user": {"username": "admin", "roles_links": [], "id":
"fcf7543999ba400bb3193ed0c337665c", "roles": [{"name":
"KeystoneServiceAdmin"}, {"name": "KeystoneAdmin"}, {"name": "admin"}],
"name": "admin"}, "metadata": {"is_admin": 0, "roles":
["499f29dcc7ab4de499a85a5c7ea619ca", "758fda19c97c4dacadff8bd3de59f9fb",
"d4a78e42d37f40318728946f5d103f4d"]}}}
0

**Comment by AbelNavarro** [comment]
Mmm, that reply from keystone, is sent in two malformed packets when you run quantum client from a different machine, and in just one malformed packet when you run quantum client from the same machine.

Are they packets "malformed" because wireshark doesn't understand the protocol? 

I'm copying the capture file in text mode because I cannot attach the binary:

```
No.     Time        Source                Destination           Protocol Length Info
      1 0.000000    10.0.1.10             10.0.1.2              TCP      74     57573 > commplex-main [SYN] Seq=0 Win=14600 Len=0 MSS=1460 SACK_PERM=1 TSval=893532724 TSecr=0 WS=128

0000  68 05 ca 03 94 70 68 05 ca 03 95 8a 08 00 45 00   h....ph.......E.
0010  00 3c 3e 8c 40 00 40 06 e6 24 0a 00 01 0a 0a 00   .<>.@.@..$......
0020  01 02 e0 e5 13 88 70 b8 04 b8 00 00 00 00 a0 02   ......p.........
0030  39 08 1f 98 00 00 02 04 05 b4 04 02 08 0a 35 42   9.............5B
0040  3a 34 00 00 00 00 01 03 03 07                     :4........

No.     Time        Source                Destination           Protocol Length Info
      2 0.000051    10.0.1.2              10.0.1.10             TCP      74     commplex-main > 57573 [SYN, ACK] Seq=0 Ack=1 Win=14480 Len=0 MSS=1460 SACK_PERM=1 TSval=676392472 TSecr=893532724 WS=128

0000  68 05 ca 03 95 8a 68 05 ca 03 94 70 08 00 45 00   h.....h....p..E.
0010  00 3c 00 00 40 00 40 06 24 b1 0a 00 01 02 0a 00   .<..@.@.$.......
0020  01 0a 13 88 e0 e5 39 8e 74 c7 70 b8 04 b9 a0 12   ......9.t.p.....
0030  38 90 16 3a 00 00 02 04 05 b4 04 02 08 0a 28 50   8..:..........(P
0040  ee 18 35 42 3a 34 01 03 03 07                     ..5B:4....

No.     Time        Source                Destination           Protocol Length Info
      3 0.000280    10.0.1.10             10.0.1.2              TCP      66     57573 > commplex-main [ACK] Seq=1 Ack=1 Win=14720 Len=0 TSval=893532724 TSecr=676392472

0000  68 05 ca 03 94 70 68 05 ca 03 95 8a 08 00 45 00   h....ph.......E.
0010  00 34 3e 8d 40 00 40 06 e6 2b 0a 00 01 0a 0a 00   .4>.@.@..+......
0020  01 02 e0 e5 13 88 70 b8 04 b9 39 8e 74 c8 80 10   ......p...9.t...
0030  00 73 c2 29 00 00 01 01 08 0a 35 42 3a 34 28 50   .s.)......5B:4(P
0040  ee 18                                             ..

No.     Time        Source                Destination           Protocol Length Info
      4 0.000598    10.0.1.10             10.0.1.2              IPA      367    unknown 0x53 [Malformed Packet]

0000  68 05 ca 03 94 70 68 05 ca 03 95 8a 08 00 45 00   h....ph.......E.
0010  01 61 3e 8e 40 00 40 06 e4 fd 0a 00 01 0a 0a 00   .a>.@.@.........
0020  01 02 e0 e5 13 88 70 b8 04 b9 39 8e 74 c8 80 18   ......p...9.t...
0030  00 73 24 56 00 00 01 01 08 0a 35 42 3a 34 28 50   .s$V......5B:4(P
0040  ee 18 50 4f 53 54 20 2f 76 32 2e 30 2f 74 6f 6b   ..POST /v2.0/tok
0050  65 6e 73 20 48 54 54 50 2f 31 2e 31 0d 0a 48 6f   ens HTTP/1.1..Ho
0060  73 74 3a 20 31 30 2e 30 2e 31 2e 32 3a 35 30 30   st: 10.0.1.2:500
0070  30 0d 0a 43 6f 6e 74 65 6e 74 2d 4c 65 6e 67 74   0..Content-Lengt
0080  68 3a 20 31 30 35 0d 0a 63 6f 6e 74 65 6e 74 2d   h: 105..content-
0090  74 79 70 65 3a 20 61 70 70 6c 69 63 61 74 69 6f   type: applicatio
00a0  6e 2f 6a 73 6f 6e 0d 0a 61 63 63 65 70 74 2d 65   n/json..accept-e
00b0  6e 63 6f 64 69 6e 67 3a 20 67 7a 69 70 2c 20 64   ncoding: gzip, d
00c0  65 66 6c 61 74 65 0d 0a 61 63 63 65 70 74 3a 20   eflate..accept: 
00d0  61 70 70 6c 69 63 61 74 69 6f 6e 2f 6a 73 6f 6e   application/json
00e0  0d 0a 75 73 65 72 2d 61 67 65 6e 74 3a 20 70 79   ..user-agent: py
00f0  74 68 6f 6e 2d 71 75 61 6e 74 75 6d 63 6c 69 65   thon-quantumclie
0100  6e 74 0d 0a 0d 0a 7b 22 61 75 74 68 22 3a 20 7b   nt....{"auth": {
0110  22 74 65 6e 61 6e 74 4e 61 6d 65 22 3a 20 22 61   "tenantName": "a
0120  64 6d 69 6e 22 2c 20 22 70 61 73 73 77 6f 72 64   dmin", "password
0130  43 72 65 64 65 6e 74 69 61 6c 73 22 3a 20 7b 22   Credentials": {"
0140  75 73 65 72 6e 61 6d 65 22 3a 20 22 61 64 6d 69   username": "admi
0150  6e 22 2c 20 22 70 61 73 73 77 6f 72 64 22 3a 20   n", "password": 
0160  22 61 64 6d 69 6e 5f 70 61 73 73 22 7d 7d 7d      "admin_pass"}}}

No.     Time        Source                Destination           Protocol Length Info
      5 0.000626    10.0.1.2              10.0.1.10             TCP      66     commplex-main > 57573 [ACK] Seq=1 Ack=302 Win=15616 Len=0 TSval=676392473 TSecr=893532724

0000  68 05 ca 03 95 8a 68 05 ca 03 94 70 08 00 45 00   h.....h....p..E.
0010  00 34 9a d1 40 00 40 06 89 e7 0a 00 01 02 0a 00   .4..@.@.........
0020  01 0a 13 88 e0 e5 39 8e 74 c8 70 b8 05 e6 80 10   ......9.t.p.....
0030  00 7a 16 32 00 00 01 01 08 0a 28 50 ee 19 35 42   .z.2......(P..5B
0040  3a 34                                             :4

No.     Time        Source                Destination           Protocol Length Info
      6 0.134262    10.0.1.2              10.0.1.10             IPA      1514   unknown 0x54 [Malformed Packet]

0000  68 05 ca 03 95 8a 68 05 ca 03 94 70 08 00 45 00   h.....h....p..E.
0010  05 dc 9a d2 40 00 40 06 84 3e 0a 00 01 02 0a 00   ....@.@..>......
0020  01 0a 13 88 e0 e5 39 8e 74 c8 70 b8 05 e6 80 10   ......9.t.p.....
0030  00 7a 1b da 00 00 01 01 08 0a 28 50 ee 3a 35 42   .z........(P.:5B
0040  3a 34 48 54 54 50 2f 31 2e 31 20 32 30 30 20 4f   :4HTTP/1.1 200 O
0050  4b 0d 0a 56 61 72 79 3a 20 58 2d 41 75 74 68 2d   K..Vary: X-Auth-
0060  54 6f 6b 65 6e 0d 0a 43 6f 6e 74 65 6e 74 2d 54   Token..Content-T
0070  79 70 65 3a 20 61 70 70 6c 69 63 61 74 69 6f 6e   ype: application
0080  2f 6a 73 6f 6e 0d 0a 44 61 74 65 3a 20 54 68 75   /json..Date: Thu
0090  2c 20 32 38 20 46 65 62 20 32 30 31 33 20 31 38   , 28 Feb 2013 18
00a0  3a 32 32 3a 33 37 20 47 4d 54 0d 0a 54 72 61 6e   :22:37 GMT..Tran
00b0  73 66 65 72 2d 45 6e 63 6f 64 69 6e 67 3a 20 63   sfer-Encoding: c
00c0  68 75 6e 6b 65 64 0d 0a 0d 0a 38 66 36 0d 0a 7b   hunked....8f6..{
00d0  22 61 63 63 65 73 73 22 3a 20 7b 22 74 6f 6b 65   "access": {"toke
00e0  6e 22 3a 20 7b 22 65 78 70 69 72 65 73 22 3a 20   n": {"expires": 
00f0  22 32 30 31 33 2d 30 33 2d 30 31 54 31 38 3a 32   "2013-03-01T18:2
0100  32 3a 33 37 5a 22 2c 20 22 69 64 22 3a 20 22 64   2:37Z", "id": "d
0110  66 32 62 65 63 34 38 31 38 63 34 34 35 38 62 38   f2bec4818c4458b8
0120  63 30 32 31 39 65 32 34 30 66 36 30 33 61 32 22   c0219e240f603a2"
0130  2c 20 22 74 65 6e 61 6e 74 22 3a 20 7b 22 65 6e   , "tenant": {"en
0140  61 62 6c 65 64 22 3a 20 74 72 75 65 2c 20 22 64   abled": true, "d
0150  65 73 63 72 69 70 74 69 6f 6e 22 3a 20 6e 75 6c   escription": nul
0160  6c 2c 20 22 6e 61 6d 65 22 3a 20 22 61 64 6d 69   l, "name": "admi
0170  6e 22 2c 20 22 69 64 22 3a 20 22 31 32 36 36 34   n", "id": "12664
0180  66 65 33 39 61 66 61 34 63 64 31 61 36 65 61 33   fe39afa4cd1a6ea3
0190  62 66 37 37 66 32 62 35 65 37 30 22 7d 7d 2c 20   bf77f2b5e70"}}, 
01a0  22 73 65 72 76 69 63 65 43 61 74 61 6c 6f 67 22   "serviceCatalog"
01b0  3a 20 5b 7b 22 65 6e 64 70 6f 69 6e 74 73 22 3a   : [{"endpoints":
01c0  20 5b 7b 22 61 64 6d 69 6e 75 72 6c 22 3a 20 22    [{"adminurl": "
01d0  68 74 74 70 3a 2f 2f 62 63 6e 32 2e 6d 69 64 6f   http://bcn2.mido
01e0  6b 75 72 61 2e 63 6f 6d 3a 38 30 38 30 2f 6d 69   kura.com:8080/mi
01f0  64 6f 6c 6d 61 6e 6a 2d 6d 67 6d 74 2f 68 6f 73   dolmanj-mgmt/hos
0200  74 73 22 2c 20 22 72 65 67 69 6f 6e 22 3a 20 22   ts", "region": "
0210  52 65 67 69 6f 6e 4f 6e 65 22 2c 20 22 70 75 62   RegionOne", "pub
0220  6c 69 63 55 52 4c 22 3a 20 22 68 74 74 70 3a 2f   licURL": "http:/
0230  2f 62 63 6e 32 2e 6d 69 64 6f 6b 75 72 61 2e 63   /bcn2.midokura.c
0240  6f 6d 3a 38 30 38 30 2f 6d 69 64 6f 6c 6d 61 6e   om:8080/midolman
0250  6a 2d 6d 67 6d 74 2f 22 2c 20 22 69 6e 74 65 72   j-mgmt/", "inter
0260  6e 61 6c 55 52 4c 22 3a 20 22 68 74 74 70 3a 2f   nalURL": "http:/
0270  2f 62 63 6e 32 2e 6d 69 64 6f 6b 75 72 61 2e 63   /bcn2.midokura.c
0280  6f 6d 3a 38 30 38 30 2f 6d 69 64 6f 6c 6d 61 6e   om:8080/midolman
0290  6a 2d 6d 67 6d 74 2f 22 7d 5d 2c 20 22 65 6e 64   j-mgmt/"}], "end
02a0  70 6f 69 6e 74 73 5f 6c 69 6e 6b 73 22 3a 20 5b   points_links": [
02b0  5d 2c 20 22 74 79 70 65 22 3a 20 22 6d 69 64 6f   ], "type": "mido
02c0  6e 65 74 22 2c 20 22 6e 61 6d 65 22 3a 20 22 4d   net", "name": "M
02d0  69 64 6f 4e 65 74 20 41 50 49 20 53 65 72 76 69   idoNet API Servi
02e0  63 65 22 7d 2c 20 7b 22 65 6e 64 70 6f 69 6e 74   ce"}, {"endpoint
02f0  73 22 3a 20 5b 7b 22 61 64 6d 69 6e 75 72 6c 22   s": [{"adminurl"
0300  3a 20 22 68 74 74 70 3a 2f 2f 6c 6f 63 61 6c 68   : "http://localh
0310  6f 73 74 3a 38 37 37 34 2f 76 31 2e 31 2f 31 32   ost:8774/v1.1/12
0320  36 36 34 66 65 33 39 61 66 61 34 63 64 31 61 36   664fe39afa4cd1a6
0330  65 61 33 62 66 37 37 66 32 62 35 65 37 30 22 2c   ea3bf77f2b5e70",
0340  20 22 72 65 67 69 6f 6e 22 3a 20 22 52 65 67 69    "region": "Regi
0350  6f 6e 4f 6e 65 22 2c 20 22 70 75 62 6c 69 63 55   onOne", "publicU
0360  52 4c 22 3a 20 22 68 74 74 70 3a 2f 2f 6c 6f 63   RL": "http://loc
0370  61 6c 68 6f 73 74 3a 38 37 37 34 2f 76 31 2e 31   alhost:8774/v1.1
0380  2f 31 32 36 36 34 66 65 33 39 61 66 61 34 63 64   /12664fe39afa4cd
0390  31 61 36 65 61 33 62 66 37 37 66 32 62 35 65 37   1a6ea3bf77f2b5e7
03a0  30 22 2c 20 22 69 6e 74 65 72 6e 61 6c 55 52 4c   0", "internalURL
03b0  22 3a 20 22 68 74 74 70 3a 2f 2f 6c 6f 63 61 6c   ": "http://local
03c0  68 6f 73 74 3a 38 37 37 34 2f 76 31 2e 31 2f 31   host:8774/v1.1/1
03d0  32 36 36 34 66 65 33 39 61 66 61 34 63 64 31 61   2664fe39afa4cd1a
03e0  36 65 61 33 62 66 37 37 66 32 62 35 65 37 30 22   6ea3bf77f2b5e70"
03f0  7d 5d 2c 20 22 65 6e 64 70 6f 69 6e 74 73 5f 6c   }], "endpoints_l
0400  69 6e 6b 73 22 3a 20 5b 5d 2c 20 22 74 79 70 65   inks": [], "type
0410  22 3a 20 22 63 6f 6d 70 75 74 65 22 2c 20 22 6e   ": "compute", "n
0420  61 6d 65 22 3a 20 22 43 6f 6d 70 75 74 65 20 53   ame": "Compute S
0430  65 72 76 69 63 65 22 7d 2c 20 7b 22 65 6e 64 70   ervice"}, {"endp
0440  6f 69 6e 74 73 22 3a 20 5b 7b 22 61 64 6d 69 6e   oints": [{"admin
0450  75 72 6c 22 3a 20 22 68 74 74 70 3a 2f 2f 6c 6f   url": "http://lo
0460  63 61 6c 68 6f 73 74 3a 39 32 39 32 2f 76 31 22   calhost:9292/v1"
0470  2c 20 22 72 65 67 69 6f 6e 22 3a 20 22 52 65 67   , "region": "Reg
0480  69 6f 6e 4f 6e 65 22 2c 20 22 70 75 62 6c 69 63   ionOne", "public
0490  55 52 4c 22 3a 20 22 68 74 74 70 3a 2f 2f 6c 6f   URL": "http://lo
04a0  63 61 6c 68 6f 73 74 3a 39 32 39 32 2f 76 31 22   calhost:9292/v1"
04b0  2c 20 22 69 6e 74 65 72 6e 61 6c 55 52 4c 22 3a   , "internalURL":
04c0  20 22 68 74 74 70 3a 2f 2f 6c 6f 63 61 6c 68 6f    "http://localho
04d0  73 74 3a 39 32 39 32 2f 76 31 22 7d 5d 2c 20 22   st:9292/v1"}], "
04e0  65 6e 64 70 6f 69 6e 74 73 5f 6c 69 6e 6b 73 22   endpoints_links"
04f0  3a 20 5b 5d 2c 20 22 74 79 70 65 22 3a 20 22 69   : [], "type": "i
0500  6d 61 67 65 22 2c 20 22 6e 61 6d 65 22 3a 20 22   mage", "name": "
0510  49 6d 61 67 65 20 53 65 72 76 69 63 65 22 7d 2c   Image Service"},
0520  20 7b 22 65 6e 64 70 6f 69 6e 74 73 22 3a 20 5b    {"endpoints": [
0530  7b 22 61 64 6d 69 6e 75 72 6c 22 3a 20 22 68 74   {"adminurl": "ht
0540  74 70 3a 2f 2f 6c 6f 63 61 6c 68 6f 73 74 3a 38   tp://localhost:8
0550  37 37 36 2f 76 31 2f 31 32 36 36 34 66 65 33 39   776/v1/12664fe39
0560  61 66 61 34 63 64 31 61 36 65 61 33 62 66 37 37   afa4cd1a6ea3bf77
0570  66 32 62 35 65 37 30 22 2c 20 22 72 65 67 69 6f   f2b5e70", "regio
0580  6e 22 3a 20 22 52 65 67 69 6f 6e 4f 6e 65 22 2c   n": "RegionOne",
0590  20 22 70 75 62 6c 69 63 55 52 4c 22 3a 20 22 68    "publicURL": "h
05a0  74 74 70 3a 2f 2f 6c 6f 63 61 6c 68 6f 73 74 3a   ttp://localhost:
05b0  38 37 37 36 2f 76 31 2f 31 32 36 36 34 66 65 33   8776/v1/12664fe3
05c0  39 61 66 61 34 63 64 31 61 36 65 61 33 62 66 37   9afa4cd1a6ea3bf7
05d0  37 66 32 62 35 65 37 30 22 2c 20 22 69 6e 74 65   7f2b5e70", "inte
05e0  72 6e 61 6c 55 52 4c 22 3a 20                     rnalURL": 

No.     Time        Source                Destination           Protocol Length Info
      7 0.134275    10.0.1.2              10.0.1.10             IPA      1055   unknown 0x74 [Malformed Packet]

0000  68 05 ca 03 95 8a 68 05 ca 03 94 70 08 00 45 00   h.....h....p..E.
0010  04 11 9a d3 40 00 40 06 86 08 0a 00 01 02 0a 00   ....@.@.........
0020  01 0a 13 88 e0 e5 39 8e 7a 70 70 b8 05 e6 80 18   ......9.zpp.....
0030  00 7a 1a 0f 00 00 01 01 08 0a 28 50 ee 3a 35 42   .z........(P.:5B
0040  3a 34 22 68 74 74 70 3a 2f 2f 6c 6f 63 61 6c 68   :4"http://localh
0050  6f 73 74 3a 38 37 37 36 2f 76 31 2f 31 32 36 36   ost:8776/v1/1266
0060  34 66 65 33 39 61 66 61 34 63 64 31 61 36 65 61   4fe39afa4cd1a6ea
0070  33 62 66 37 37 66 32 62 35 65 37 30 22 7d 5d 2c   3bf77f2b5e70"}],
0080  20 22 65 6e 64 70 6f 69 6e 74 73 5f 6c 69 6e 6b    "endpoints_link
0090  73 22 3a 20 5b 5d 2c 20 22 74 79 70 65 22 3a 20   s": [], "type": 
00a0  22 76 6f 6c 75 6d 65 22 2c 20 22 6e 61 6d 65 22   "volume", "name"
00b0  3a 20 22 56 6f 6c 75 6d 65 20 53 65 72 76 69 63   : "Volume Servic
00c0  65 22 7d 2c 20 7b 22 65 6e 64 70 6f 69 6e 74 73   e"}, {"endpoints
00d0  22 3a 20 5b 7b 22 61 64 6d 69 6e 75 72 6c 22 3a   ": [{"adminurl":
00e0  20 22 68 74 74 70 3a 2f 2f 6c 6f 63 61 6c 68 6f    "http://localho
00f0  73 74 3a 38 37 37 33 2f 73 65 72 76 69 63 65 73   st:8773/services
0100  2f 41 64 6d 69 6e 22 2c 20 22 72 65 67 69 6f 6e   /Admin", "region
0110  22 3a 20 22 52 65 67 69 6f 6e 4f 6e 65 22 2c 20   ": "RegionOne", 
0120  22 70 75 62 6c 69 63 55 52 4c 22 3a 20 22 68 74   "publicURL": "ht
0130  74 70 3a 2f 2f 6c 6f 63 61 6c 68 6f 73 74 3a 38   tp://localhost:8
0140  37 37 33 2f 73 65 72 76 69 63 65 73 2f 43 6c 6f   773/services/Clo
0150  75 64 22 2c 20 22 69 6e 74 65 72 6e 61 6c 55 52   ud", "internalUR
0160  4c 22 3a 20 22 68 74 74 70 3a 2f 2f 6c 6f 63 61   L": "http://loca
0170  6c 68 6f 73 74 3a 38 37 37 33 2f 73 65 72 76 69   lhost:8773/servi
0180  63 65 73 2f 43 6c 6f 75 64 22 7d 5d 2c 20 22 65   ces/Cloud"}], "e
0190  6e 64 70 6f 69 6e 74 73 5f 6c 69 6e 6b 73 22 3a   ndpoints_links":
01a0  20 5b 5d 2c 20 22 74 79 70 65 22 3a 20 22 65 63    [], "type": "ec
01b0  32 22 2c 20 22 6e 61 6d 65 22 3a 20 22 45 43 32   2", "name": "EC2
01c0  20 53 65 72 76 69 63 65 22 7d 2c 20 7b 22 65 6e    Service"}, {"en
01d0  64 70 6f 69 6e 74 73 22 3a 20 5b 7b 22 61 64 6d   dpoints": [{"adm
01e0  69 6e 75 72 6c 22 3a 20 22 68 74 74 70 3a 2f 2f   inurl": "http://
01f0  6c 6f 63 61 6c 68 6f 73 74 3a 33 35 33 35 37 2f   localhost:35357/
0200  76 32 2e 30 22 2c 20 22 72 65 67 69 6f 6e 22 3a   v2.0", "region":
0210  20 22 52 65 67 69 6f 6e 4f 6e 65 22 2c 20 22 70    "RegionOne", "p
0220  75 62 6c 69 63 55 52 4c 22 3a 20 22 68 74 74 70   ublicURL": "http
0230  3a 2f 2f 6c 6f 63 61 6c 68 6f 73 74 3a 35 30 30   ://localhost:500
0240  30 2f 76 32 2e 30 22 2c 20 22 69 6e 74 65 72 6e   0/v2.0", "intern
0250  61 6c 55 52 4c 22 3a 20 22 68 74 74 70 3a 2f 2f   alURL": "http://
0260  6c 6f 63 61 6c 68 6f 73 74 3a 35 30 30 30 2f 76   localhost:5000/v
0270  32 2e 30 22 7d 5d 2c 20 22 65 6e 64 70 6f 69 6e   2.0"}], "endpoin
0280  74 73 5f 6c 69 6e 6b 73 22 3a 20 5b 5d 2c 20 22   ts_links": [], "
0290  74 79 70 65 22 3a 20 22 69 64 65 6e 74 69 74 79   type": "identity
02a0  22 2c 20 22 6e 61 6d 65 22 3a 20 22 49 64 65 6e   ", "name": "Iden
02b0  74 69 74 79 20 53 65 72 76 69 63 65 22 7d 5d 2c   tity Service"}],
02c0  20 22 75 73 65 72 22 3a 20 7b 22 75 73 65 72 6e    "user": {"usern
02d0  61 6d 65 22 3a 20 22 61 64 6d 69 6e 22 2c 20 22   ame": "admin", "
02e0  72 6f 6c 65 73 5f 6c 69 6e 6b 73 22 3a 20 5b 5d   roles_links": []
02f0  2c 20 22 69 64 22 3a 20 22 66 63 66 37 35 34 33   , "id": "fcf7543
0300  39 39 39 62 61 34 30 30 62 62 33 31 39 33 65 64   999ba400bb3193ed
0310  30 63 33 33 37 36 36 35 63 22 2c 20 22 72 6f 6c   0c337665c", "rol
0320  65 73 22 3a 20 5b 7b 22 6e 61 6d 65 22 3a 20 22   es": [{"name": "
0330  4b 65 79 73 74 6f 6e 65 53 65 72 76 69 63 65 41   KeystoneServiceA
0340  64 6d 69 6e 22 7d 2c 20 7b 22 6e 61 6d 65 22 3a   dmin"}, {"name":
0350  20 22 4b 65 79 73 74 6f 6e 65 41 64 6d 69 6e 22    "KeystoneAdmin"
0360  7d 2c 20 7b 22 6e 61 6d 65 22 3a 20 22 61 64 6d   }, {"name": "adm
0370  69 6e 22 7d 5d 2c 20 22 6e 61 6d 65 22 3a 20 22   in"}], "name": "
0380  61 64 6d 69 6e 22 7d 2c 20 22 6d 65 74 61 64 61   admin"}, "metada
0390  74 61 22 3a 20 7b 22 69 73 5f 61 64 6d 69 6e 22   ta": {"is_admin"
03a0  3a 20 30 2c 20 22 72 6f 6c 65 73 22 3a 20 5b 22   : 0, "roles": ["
03b0  34 39 39 66 32 39 64 63 63 37 61 62 34 64 65 34   499f29dcc7ab4de4
03c0  39 39 61 38 35 61 35 63 37 65 61 36 31 39 63 61   99a85a5c7ea619ca
03d0  22 2c 20 22 37 35 38 66 64 61 31 39 63 39 37 63   ", "758fda19c97c
03e0  34 64 61 63 61 64 66 66 38 62 64 33 64 65 35 39   4dacadff8bd3de59
03f0  66 39 66 62 22 2c 20 22 64 34 61 37 38 65 34 32   f9fb", "d4a78e42
0400  64 33 37 66 34 30 33 31 38 37 32 38 39 34 36 66   d37f40318728946f
0410  35 64 31 30 33 66 34 64 22 5d 7d 7d 7d 0d 0a      5d103f4d"]}}}..

No.     Time        Source                Destination           Protocol Length Info
      8 0.134427    10.0.1.10             10.0.1.2              TCP      66     57573 > commplex-main [ACK] Seq=302 Ack=2438 Win=19584 Len=0 TSval=893532758 TSecr=676392506

0000  68 05 ca 03 94 70 68 05 ca 03 95 8a 08 00 45 00   h....ph.......E.
0010  00 34 3e 8f 40 00 40 06 e6 29 0a 00 01 0a 0a 00   .4>.@.@..)......
0020  01 02 e0 e5 13 88 70 b8 05 e6 39 8e 7e 4d 80 10   ......p...9.~M..
0030  00 99 b7 0d 00 00 01 01 08 0a 35 42 3a 56 28 50   ..........5B:V(P
0040  ee 3a                                             .:

No.     Time        Source                Destination           Protocol Length Info
      9 0.134451    10.0.1.2              10.0.1.10             IPA      71     unknown 0x0a [Malformed Packet]

0000  68 05 ca 03 95 8a 68 05 ca 03 94 70 08 00 45 00   h.....h....p..E.
0010  00 39 9a d4 40 00 40 06 89 df 0a 00 01 02 0a 00   .9..@.@.........
0020  01 0a 13 88 e0 e5 39 8e 7e 4d 70 b8 05 e6 80 18   ......9.~Mp.....
0030  00 7a 16 37 00 00 01 01 08 0a 28 50 ee 3a 35 42   .z.7......(P.:5B
0040  3a 56 30 0d 0a 0d 0a                              :V0....

No.     Time        Source                Destination           Protocol Length Info
     10 0.134505    10.0.1.10             10.0.1.2              TCP      66     57573 > commplex-main [ACK] Seq=302 Ack=2443 Win=19584 Len=0 TSval=893532758 TSecr=676392506

0000  68 05 ca 03 94 70 68 05 ca 03 95 8a 08 00 45 00   h....ph.......E.
0010  00 34 3e 90 40 00 40 06 e6 28 0a 00 01 0a 0a 00   .4>.@.@..(......
0020  01 02 e0 e5 13 88 70 b8 05 e6 39 8e 7e 52 80 10   ......p...9.~R..
0030  00 99 b7 08 00 00 01 01 08 0a 35 42 3a 56 28 50   ..........5B:V(P
0040  ee 3a                                             .:

No.     Time        Source                Destination           Protocol Length Info
     11 0.135690    10.0.1.10             10.0.1.2              TCP      66     57573 > commplex-main [FIN, ACK] Seq=302 Ack=2443 Win=19584 Len=0 TSval=893532758 TSecr=676392506

0000  68 05 ca 03 94 70 68 05 ca 03 95 8a 08 00 45 00   h....ph.......E.
0010  00 34 3e 91 40 00 40 06 e6 27 0a 00 01 0a 0a 00   .4>.@.@..'......
0020  01 02 e0 e5 13 88 70 b8 05 e6 39 8e 7e 52 80 11   ......p...9.~R..
0030  00 99 b7 07 00 00 01 01 08 0a 35 42 3a 56 28 50   ..........5B:V(P
0040  ee 3a                                             .:

No.     Time        Source                Destination           Protocol Length Info
     12 0.135819    10.0.1.2              10.0.1.10             TCP      66     commplex-main > 57573 [FIN, ACK] Seq=2443 Ack=303 Win=15616 Len=0 TSval=676392506 TSecr=893532758

0000  68 05 ca 03 95 8a 68 05 ca 03 94 70 08 00 45 00   h.....h....p..E.
0010  00 34 9a d5 40 00 40 06 89 e3 0a 00 01 02 0a 00   .4..@.@.........
0020  01 0a 13 88 e0 e5 39 8e 7e 52 70 b8 05 e7 80 11   ......9.~Rp.....
0030  00 7a 16 32 00 00 01 01 08 0a 28 50 ee 3a 35 42   .z.2......(P.:5B
0040  3a 56                                             :V

No.     Time        Source                Destination           Protocol Length Info
     13 0.135885    10.0.1.10             10.0.1.2              TCP      66     57573 > commplex-main [ACK] Seq=303 Ack=2444 Win=19584 Len=0 TSval=893532758 TSecr=676392506

0000  68 05 ca 03 94 70 68 05 ca 03 95 8a 08 00 45 00   h....ph.......E.
0010  00 34 3e 92 40 00 40 06 e6 26 0a 00 01 0a 0a 00   .4>.@.@..&......
0020  01 02 e0 e5 13 88 70 b8 05 e7 39 8e 7e 53 80 10   ......p...9.~S..
0030  00 99 b7 06 00 00 01 01 08 0a 35 42 3a 56 28 50   ..........5B:V(P
0040  ee 3a                                             .:

```

**Comment by AbelNavarro** [comment]
Yes, the packets were "malformed" because wireshark used a wrong protocol for decoding. It should be  something else.

**Comment by AbelNavarro** [comment]
Found the problem: service catalog was incorrect.

We changed the service catalog from MySQL backend to text backend in order to accomodate control panel changes. Although I added the midonet section, the other sections weren't updated. I took the catalog from MySQL and copied that to the text catalog.

For the reference:

A good way to debug this kind of problems is with `curl` instead of packet capture. I used these:

```
curl http://localhost:5000
curl http://localhost:35357
curl -d '{"auth": {"tenantName": "admin", "passwordCredentials": {"username":"admin", "password": "admin_pass"}}}' -H "Content-type: application/json" http://localhost:5000/v2.0/tokens -v
```

Examples of curl commands for keystone can be found at: http://docs.openstack.org/developer/keystone/api_curl_examples.html

This is the new catalog file I'm using:

```
# config for TemplatedCatalog, using camelCase because I don't want to do
# translations for keystone compat
catalog.RegionOne.identity.publicURL = http://bcn2.midokura.com:$(public_port)s/v2.0
catalog.RegionOne.identity.adminURL = http://bcn2.midokura.com:$(admin_port)s/v2.0
catalog.RegionOne.identity.internalURL = http://bcn2.midokura.com:$(public_port)s/v2.0
catalog.RegionOne.identity.name = Identity Service

# fake compute service for now to help novaclient tests work
catalog.RegionOne.compute.publicURL = http://bcn2.midokura.com:$(compute_port)s/v2/$(tenant_id)s
catalog.RegionOne.compute.adminURL = http://bcn2.midokura.com:$(compute_port)s/v2/$(tenant_id)s
catalog.RegionOne.compute.internalURL = http://bcn2.midokura.com:$(compute_port)s/v2/$(tenant_id)s
catalog.RegionOne.compute.name = Compute Service

catalog.RegionOne.volume.publicURL = http://bcn2.midokura.com:8776/v1/$(tenant_id)s
catalog.RegionOne.volume.adminURL = http://bcn2.midokura.com:8776/v1/$(tenant_id)s
catalog.RegionOne.volume.internalURL = http://bcn2.midokura.com:8776/v1/$(tenant_id)s
catalog.RegionOne.volume.name = Volume Service

catalog.RegionOne.ec2.publicURL = http://bcn2.midokura.com:8773/services/Cloud
catalog.RegionOne.ec2.adminURL = http://bcn2.midokura.com:8773/services/Admin
catalog.RegionOne.ec2.internalURL = http://bcn2.midokura.com:8773/services/Cloud
catalog.RegionOne.ec2.name = EC2 Service

catalog.RegionOne.image.publicURL = http://bcn2.midokura.com:9292/v2
catalog.RegionOne.image.adminURL = http://bcn2.midokura.com:9292/v2
catalog.RegionOne.image.internalURL = http://bcn2.midokura.com:9292/v2
catalog.RegionOne.image.name = Image Service

catalog.RegionOne.identity.publicURL = http://bcn2.midokura.com:5000/v2.0
catalog.RegionOne.identity.adminURL = http://bcn2.midokura.com:35357/v2.0
catalog.RegionOne.identity.internalURL = http://bcn2.midokura.com:5000/v2.0
catalog.RegionOne.identity.name = Identity Service

catalog.RegionOne.network.publicURL = http://bcn2.midokura.com:9696/
catalog.RegionOne.network.adminURL = http://bcn2.midokura.com:9696/
catalog.RegionOne.network.internalURL = http://bcn2.midokura.com:9696/
catalog.RegionOne.network.name = Network Service

# Midonet
catalog.RegionOne.midonet.publicURL = http://bcn2.midokura.com:8080/midolmanj-mgmt/
catalog.RegionOne.midonet.adminURL = http://bcn2.midokura.com:8080/midolmanj-mgmt/hosts
catalog.RegionOne.midonet.internalURL = http://bcn2.midokura.com:8080/midolmanj-mgmt/
catalog.RegionOne.midonet.name = MidoNet API Service
```
